{"artifacts":{"asset_manifest":{"path":"asset-manifest.json","sha256":"0b396a0cf66ddcb6151eba5ab3ba4cd4b9213c28907a8cd639b0a900093243f7"},"claim_map":{"path":"claim-map.json","sha256":"d66aeccaf74c8ff6627269872b543774eed2ec208b98f22c0086da59152c50da"},"evaluation":{"path":"evaluation.json","sha256":"68e0962bd35acf39b28ec212ea4d5622dd642ee40db777e3c51f7ff3e5a00e26"},"evidence":{"path":"repository-evidence.json","sha256":"56c230374bf6ed4d075c63a4aa7d70e462bb51c893f570bc18724595d4bd892f"},"plan":{"path":"readme-plan.json","sha256":"f3a1118d2ac7b0e781f0b32f7ea994b8022e15e1a70ac39cff59a69685259cc8"},"retrieval":{"path":"retrieval-packet.json","sha256":"722ea71c16934e7c6a41c956e48b5dd4b9563444acecc58d4e2946f9c4d9a5d3"}},"candidate":{"assets":[{"path":"assets/hero.png","sha256":"235e038991789e2eae934ad370c87ea2edf1255811ac9cc5353e4ef1865c679c"}],"candidate_sha256":"7999ae23bec4784b3cf704439ef00c0d4c5ccbc708fca28d40b30abe68956b27","readme":{"path":"README.generated.md","sha256":"875dce0e99707525fd7cb06b8691ff5d783ef8e115ebd47164885edb2e40c905"}},"mode":"readme","schema_version":2,"target":{"base_sha":"aaaaaaaaaaaaaaaaaaaaaaaaaaaaaaaaaaaaaaaa","repository":"owner/repo"}}
